{
  "id": "prime-video",
  "name": "Prime Video",
  "description": "Show Prime Video's series, episode name and numbers, matching preview artwork, playback state and progress.",
  "version": "1.1.0",
  "apiVersion": 2,
  "minExtensionVersion": "2.0.0",
  "author": { "name": "ChudPresence" },
  "category": "video",
  "defaultMediaKind": "video",
  "aliases": ["Amazon Prime Video", "Amazon Video"],
  "tags": ["movies", "tv", "streaming"],
  "serviceUrl": "https://www.primevideo.com/",
  "matches": [
    "https://www.primevideo.com/*",
    "https://primevideo.com/*",
    "https://www.amazon.com/gp/video/*",
    "https://amazon.com/gp/video/*"
  ],
  "entry": "activity.json",
  "settingsUi": {
    "statusLabels": { "app": "Prime Video", "artist": "Title", "track": "Episode" }
  }
}
